X,Y,SITEADDRESS,CITY,ZIPCODE,PERMITSTATUS,PERMITYEAR,PROJECTNAME,PROJECTDESCRIPTION,ISSUEDDATE,TOTALPAID,SUBAREA,NEIGHBORHOODAREA,SUBTYPE,ZONING,LOTSIZE
-122.12677983299999,47.6205598060001,16000 NE 10th St,Bellevue,98008391,Issued,2021,Crossroads Boiler,"Crossroads Boiler Replacement - provide and install 2 new Heat Pump Water Heaters and 2 pumps.  Connect to existing gas, hot water supply & return piping, condensate, relief drain and controls. Provide new 4"" PVC flue and combustion using existing roof penetration.",2021/09/03 06:59:59+00,1146.0,Crossroads,Crossroads,Nonresidential,[O] Office,1164222.0
-122.16869875200001,47.582447453,12822 SE 32nd St,Bellevue,98005431,Issued,2021,21-21-19697 Millipore-Sigma RTU Replacement,Replace existing RTU with new RTU.,2021/07/24 06:59:59+00,1315.0,Richards Valley,Woodridge,Nonresidential,[O] Office,86888.0
-122.186390556,47.607609804,301 116th Ave SE,Bellevue,980046401,Issued,2021,Ameriprise Financial Ste 500,Relocate existing supply diffusers/duct work and add and relocate return grilles to meet new requirements for Ameriprise Financial TI.,2021/07/27 06:59:59+00,599.0,Wilburton/ne 8th St,Wilburton,Nonresidential,[OLB] Office and Limited Business,157375.0
-122.187614091,47.605872711000096,405 114th Ave SE,Bellevue,980046424,Closed,2021,Cordova Building,"Ductwork revisions and diffuser addition and relocation for existing VAV boxes, existing heat pump, and existing AC unit.  All work is interior only.",2021/07/27 06:59:59+00,653.0,Southwest Bellevue,West Bellevue,Nonresidential,[OLB] Office and Limited Business,77549.0
-122.143420548,47.608494863000004,35 148th Ave SE,Bellevue,980065166,Pending,2021,Philip Jung DDS,Replace the (2) 5ton RTU,,735.0,Southeast Bellevue,Lake Hills,Nonresidential,[O] Office,16195.0
-122.152882634,47.632211452,14030 NE 24th St,Bellevue,980073729,Issued,2021,PHYNET DERMATOLOGY,"RELOCATE AND ADD SUPPLY DIFFUSERS, RETURN GRILLES AND ZONE DAMPERS AS SHOWN ON HVAC DRAWINGS. ADD (2) INLINE EXHAUST FANS.",2021/08/17 06:59:59+00,1547.0,Bridle Trails,Bridle Trails,Nonresidential,[PO] Professional Office,39588.0
-122.14884349100001,47.631448004,14335 NE 24th St  - Bldg B,Bellevue,980073739,Issued,2021,Overlake 520 W,"Adjust existing ductwork and installation of new transfer fan for break room.
21 110113 BZ",2021/08/18 06:59:59+00,536.0,Belred,Belred,Nonresidential,[BR-OR] Bel-Red Office/Residential,
-122.18549151299999,47.6012901290001,915 118th Ave SE,Bellevue,980053855,Issued,2021,Gateway II,"DEMO EXISTING MCQUAY AIR CONDITIONING UNIT AND DISPOSE OF IN ACCORDANCE WITH EPA STANDARDS. PROVIDE AND INSTALL (1) NEW TRANE 60-TON MODULAT SELF-CONTAINED AIR-CONDITIONING UNIT, LIKE-FOR-LIKE REPLACEMENT, PER PLAN.",2021/08/18 06:59:59+00,4739.0,Richards Valley,West Bellevue,Nonresidential,[OLB] Office and Limited Business,972.0
-122.126738378,47.616469303,16007 NE 8th St,Bellevue,980073909,Issued,2021,Pikake  School,Installation of new range hood.,2021/09/17 06:59:59+00,206.0,Crossroads,Lake Hills,Nonresidential,[O] Office,43948.0
-122.187614091,47.605872711000096,405 114th Ave SE,Bellevue,980046424,Issued,2021,Cordova,Install 1 new rooftop package heat pump. and 1 new ERV for a DOAS system.  Minor ductwork revision to an existing VAV box.  Add 2 fire dampers,2021/08/24 06:59:59+00,1060.0,Southwest Bellevue,West Bellevue,Nonresidential,[OLB] Office and Limited Business,77549.0
-122.190039805,47.622049848000096,1200 112th Ave NE  - Suite C-154,Bellevue,980043708,Ready to Issue,2021,Sonobello Suite 154 TI,"THE PROPOSED PROJECT IS FOR A 690 SF TENANT IMPROVEMENT TO AN EXISTING BUILDING FOR AN EXISTING TENANT. ALL PROPOSED IMPROVEMENTS ARE TO THE INTERIOR OF SUITE C-154 AND ARE NON-STRUCTURAL. THE PROPOSED IMPROVEMENTS ARE TO&#13;&#10;CREATE THREE NEW EXAM ROOMS, A CHART ROOM, AND AN OFFICE, 116578 BZ",,180.0,North Bellevue,Northwest Bellevue,Nonresidential,[OLB] Office and Limited Business,181414.0
-122.190039805,47.622049848000096,1200 112th Ave NE  - Suite C-250,Bellevue,980043708,Ready to Issue,2021,Sonobello Suite 235 TI,"THE PROPOSED PROJECT IS FOR A 1,254 SF TENANT IMPROVEMENT TO AN EXISTING BUILDING.  ALL PROPOSED IMPROVEMENTS ARE TO THE INTEROR OF SUITE C-235 AND ARE NON-STRUCTURAL., 21 116577 BZ",,440.0,North Bellevue,Northwest Bellevue,Nonresidential,[OLB] Office and Limited Business,
-122.18370733200001,47.600839281000006,929 118th Ave SE,Bellevue,980053855,Issued,2021,Greenbaum,Replace (2) existing heat pumps on new adapter curbs.,2021/09/01 06:59:59+00,1307.0,Richards Valley,West Bellevue,Nonresidential,[OLB] Office and Limited Business,72418.0
-122.189327125,47.5959349460001,1800 114th Ave SE,Bellevue,98004,Pending,2021,RoundGlass Office Remodel,"Provide and install (5) new VAV's, 1 new split system, and new VRF system.  Provide and install (2) new RTU for direct replacement of existing.  Perform misc. duct, piping and GRD mods. as required.",,5926.0,Southwest Bellevue,West Bellevue,Nonresidential,[O] Office,184965.0
-122.178855175,47.6218260090001,1375 121st Ave NE  - Lot 17,Bellevue,980052101,Issued,2021,GOLFTEC,"Installation of one (1) split system heat pump, one (1) energy recovery ventilator, one (1) exhaust fan, three (3) louvers, ductwork, and grilles/diffusers., 21 109129 BY",2021/09/21 06:59:59+00,1701.0,Belred,Belred,Nonresidential,[BR-OR-2] Bel-Red-Office/Residential Node 2,829376.0
-122.185060654,47.626176357000105,1800 116th Ave NE,Bellevue,980043022,Pending,2021,OHMC - Mother Baby Clinic,"THE PROJECT INCLUDES THE SELECTIVE DEMOLITION AND REMODEL OF AN EXISTING MEDICAL CLINIC SPACE ON THE SECOND FLOOR OF AN EXISTING MEDICAL OFFICE BUILDING. THE SPACE WILL BE RENOVATED INTO A NEW MOTHER BABY CLINIC FOR OVERLAKE MEDICAL HOSPITAL. THE CLINIC WILL BE UNDER THE HOSPITAL LICENSE. &#13;&#10;&#13;&#10;THE PROJECT  WILL INCLUDE NINE EXAM ROOMS WITH OFFICES AND ANCILLARY SPACES FOR THE SUPPORT OF CLINIC OPERATION, RECEPTION AND WAITING, A BOUTIQUE WITH SUPPORT SPACES AND A CLASSROOM SPACE. THE PROJECT AREA IS 4930 SF.",,3364.0,Belred,Belred,Nonresidential,[BR-MO] Bel-Red-Medical Office,43201.0
-122.189373164,47.605530721,11200 SE 6th St,Bellevue,980046403,Issued,2021,14-21-19481 Bellevue Club TI,Provide and install (3) fan coil units and (3) heat pumps.,2021/09/14 06:59:59+00,692.0,Southwest Bellevue,West Bellevue,Nonresidential,[OLB] Office and Limited Business,394671.0
-122.196001217,47.63818607899999,3025 112th Ave NE  - Bldg A,Bellevue,980048002,Issued,2021,OHMC Information Services,As a part of this project we will be making alterations to the existing space by demoing (7) existing dual duct VAV boxes and replacing them with (9) new dual duct VAV boxes. Also added in the space will be a split system unit. We will be also be adding ductwork and diffusers in the space.,2021/09/14 06:59:59+00,2869.0,North Bellevue,Northwest Bellevue,Nonresidential,[OLB] Office and Limited Business,165631.0
-122.175530474,47.6211786490001,12355 NE District Way,Bellevue,980052101,Issued,2021,Block 24 - Mechanical T.I. Permit (Levels C & D),"Mechanical T.I. permit for addition of Mechanical BAS room on Level C and storage room on Level D., 21-108375 BZ",2021/05/14 06:59:59+00,653.0,Belred,Belred,Nonresidential,[BR-OR-2] Bel-Red-Office/Residential Node 2,
-122.164826759,47.631289608,2340 130th Ave NE  - Bldg D,Bellevue,98005,Issued,2021,Northup North Bldg D GP#6,Change out GP-6 like for like in the same location,2021/04/02 06:59:59+00,952.0,Bridle Trails,Bridle Trails,Nonresidential,[PO] Professional Office,
-122.185581291,47.6345933950001,2630 116th Ave NE,Bellevue,980041422,Issued,2021,116 BLDG TWO SPLIT UNITS,- FURNISH AND INSTALL (2) NEW CARRIER FAN COIL UNITS AND (2) NEW CARRIER CONDENSING UNITS (LIKE FOR LIKE REPLACEMENT)&#13;&#10;- DEMO (2) EXISTING FAN COIL AND CONDENSING UNITS,2021/09/17 06:59:59+00,1337.0,Bridle Trails,Bridle Trails,Nonresidential,[OLB] Office and Limited Business,
-122.191560539,47.629832097000104,2155 112th Ave NE,Bellevue,980042949,Issued,2021,Tschetter Group TI,MODIFY EXISTING DUCTWORK TO ACCOMMODATE TENANT IMPROVEMENT.  RELOCATE 6 EXISTING THERMOSTATS.  INSTALL 7 NEW CEILING EXHAUST FANS.,2021/10/01 06:59:59+00,1034.0,North Bellevue,Northwest Bellevue,Nonresidential,[O] Office,28422.0
-122.133772061,47.583278099,15500 SE 30th Pl,Bellevue,98007,Closed,2021,Agilysys,"Provide and install (1) new split system for the server room.  Includes piping, duct and GRD's.",2021/03/18 06:59:59+00,760.0,Eastgate,Eastgate,Nonresidential,[O] Office,154511.0
-122.13529760799999,47.582761725000104,15395 SE 30th Pl  - Bldg 4,Bellevue,98007653,Closed,2021,Wizards of the Coast,"Relocate (5) WSHP's, Install (1) new WSHP and EF and misc. piping, GRD and duct mods. 1 new heat pump.",2021/04/16 06:59:59+00,1115.0,Eastgate,Eastgate,Nonresidential,[O] Office,
-122.18989652,47.596642236,1715 114th Ave SE,Bellevue,980046904,Closed,2021,BOP Woodridge - CT Replacement,Replace cooling tower,2021/06/11 06:59:59+00,2840.0,Southwest Bellevue,West Bellevue,Nonresidential,[O] Office,
-122.19435475,47.637575629,3009 112th Ave NE,Bellevue,980042066,Closed,2021,MN Custom Homes,Demo HVAC units and ductwork per plan. Relocate VAV boxes per plan. Installation/relocation of new and existing diffusers and ductwork as needed.,2021/06/08 06:59:59+00,2557.0,North Bellevue,Northwest Bellevue,Nonresidential,[OLB] Office and Limited Business,
-122.17820742100001,47.6260350840001,1747 124th Ave NE,Bellevue,980052101,Issued,2021,Safeway-Ice Cream,Install rooftop evaporator unit (21 108932 BZ).,2021/06/11 06:59:59+00,7672.0,Belred,Belred,Nonresidential,[BR-OR-2] Bel-Red-Office/Residential Node 2,
-122.12804508200001,47.5824068040001,3106 160th Ave SE,Bellevue,98008,Issued,2021,T-Mobile Connector Bldg 12/13,"Install (9) new watersource heat pumps and associated ductwork and diffusers. install (2) new transfer fans. Install (5) new radiant patio heaters. Connect distribution ductwork to a DOAS unit installed during the shell and core phase of this project, per plan., 20 122827 BY, 20 101687 BB",2021/07/12 06:59:59+00,6299.0,Eastgate,Eastgate,Nonresidential,[OLB] Office and Limited Business,
-122.165664298,47.631318179000104,2330 130th Ave NE  - Bldg C,Bellevue,98005,Closed,2021,Northup North - Bldg C,Like for like replacement of four 5T package units and three 4T package units. Reuse existing curbs and connect to existing systems.,2021/06/24 06:59:59+00,3398.0,Bridle Trails,Bridle Trails,Nonresidential,[PO] Professional Office,
-122.185581291,47.6345933950001,2630 116th Ave NE,Bellevue,980041422,Closed,2021,116 Building Replacement Three Spit Units,"FURNISH AND INSTALL (3) NEW CARRIER FAN COIL UNITS AND (3) NEW CARRIER CONDENSING UNITS (LIKE FOR LIKE REPLACEMENT). DEMO (3) EXISTING FAN COIL AND CONDENSING UNITS, PER PLAN.",2021/06/28 06:59:59+00,1411.0,Bridle Trails,Bridle Trails,Nonresidential,[OLB] Office and Limited Business,
-122.176090055,47.618940435000106,12340 NE 8th St,Bellevue,980053189,Ready to Issue,2021,Dr Chang Hilltop,Replacing 8 heat pumps and 8 air handlers with one VRV heat recovery inverter heat pump 20 ton and 8 air handlers.,,1795.0,Wilburton/ne 8th St,Wilburton,Nonresidential,[O] Office,26173.0
-122.19057145200001,47.6244439970001,1500 112th Ave NE,Bellevue,980043731,Issued,2021,KM Building,"Replace 3 existing rooftop units that are not working right, with the new units - same size in BTU's",2021/08/05 06:59:59+00,1122.0,North Bellevue,Northwest Bellevue,Nonresidential,[O] Office,18879.0
-122.127868702,47.629201816000005,2125 158th Ct NE  - Bldg C,Bellevue,980082409,Issued,2021,Amenity Center,1) Move 4 existing pneumatic (air) thermostats. &#13;&#10;2) Move 2 existing supply air grills.,2021/07/06 06:59:59+00,172.0,Crossroads,Northeast Bellevue,Nonresidential,[O] Office,
-122.15537711700001,47.623543925,13851 NE Bellevue-Redmond Rd,Bellevue,980054519,Closed,2021,Early World -Annex,"Install 2 High wall mount ductless split air handlers and 2 12,000 BTU condensing unit heat pumps mounted on wall bracket. Each weigh 60lbs. Also install 1 room ventilator.",2021/07/13 06:59:59+00,1007.0,Belred,Belred,Nonresidential,[BR-ORT] Bel-Red-Office/Residential Transition,29139.0
-122.176257814,47.623550796000096,1615 123rd Ave NE  - Lot 5-A,Bellevue,980052101,Pending,2021,Block 5 - Above-Grade Mechanical Permit,"Mechanical equipment and systems for Levels 1 through 11 of the Block 5 office building., 20-110219 BB",,48281.0,Belred,Belred,Nonresidential,[BR-OR-1] Bel-Red-Office/Residential Node 1,
-122.12837744299999,47.628405453,2035 158th Ct NE  - Bldg D-2,Bellevue,980082409,Closed,2021,Quotelab,"Move 5 wireless thermostats, Install 6 new supply air grills with ductwork, Install 5 new sidewall return air grills and Install 8 sound boots to the existing mixing boxes.",2021/03/29 06:59:59+00,434.0,Crossroads,Northeast Bellevue,Nonresidential,[O] Office,
-122.12677983299999,47.6205598060001,16000 NE 10th St,Bellevue,98008391,Closed,2021,Crossroads Split System,Crossroads Split System Replacement,2021/04/02 06:59:59+00,1146.0,Crossroads,Crossroads,Nonresidential,[O] Office,1164222.0
-122.154088911,47.581822605000106,3180 139th Ave SE,Bellevue,98005,Closed,2021,ArenaNet Flrs 4 & 5,Provide and install new VAV's and perform misc. duct and GRD mods. per drawings.,2021/04/05 06:59:59+00,1565.0,Eastgate,Eastgate,Nonresidential,[OLB] Office and Limited Business,48168.0
-122.175530474,47.6211786490001,12355 NE District Way,Bellevue,980052101,Closed,2021,Facebook Block 24,"Installation of a prefabricated Walk-In Cooler/ Freezer Combo Box. Install Refrigeration to Combo Cooler, Freezer Box, and Blast Chiller.",2021/06/11 06:59:59+00,807.0,Belred,Belred,Nonresidential,[BR-OR-2] Bel-Red-Office/Residential Node 2,
-122.190124759,47.6377464380001,3006 Northup Way,Bellevue,980041407,Closed,2021,Northup,"Install ductless mini split in elevator machine room per code. Run line sets in drop ceiling and mount outdoor unit on pad behind building on pad next to other HVAC, install line hid were line sets are exposed.",2021/04/22 06:59:59+00,388.0,North Bellevue,Northwest Bellevue,Nonresidential,[OLB] Office and Limited Business,100173.0
-122.186014974,47.606501242,335 116th Ave SE,Bellevue,980046437,Closed,2021,Master Builders L2,Replace (1) water source heat pump.,2021/04/15 06:59:59+00,343.0,Wilburton/ne 8th St,Wilburton,Nonresidential,[OLB] Office and Limited Business,57236.0
-122.18018874399999,47.612277933,220 120th Ave NE,Bellevue,98005,Issued,2021,14-21-18958 Ridgewood D RTU,Replace (1) 50 ton RTU with like kind.,2021/06/01 06:59:59+00,3293.0,Wilburton/ne 8th St,Wilburton,Nonresidential,[O] Office,
-122.183002681,47.6102080850001,11660 Main St,Bellevue,98005352,Closed,2021,McDowell House,McDowell House - Provide and install 3-ton heat pump with gas furnace and heating coil.,2021/04/29 06:59:59+00,750.0,Wilburton/ne 8th St,Wilburton,Nonresidential,[O] Office,25809.0
-122.17873104700001,47.622413136000006,1550 121st Ave NE,Bellevue,980052101,Issued,2021,Facebook Main Building Cafe,Adding kitchen/cafe to Facebook Main Building.,2021/07/07 06:59:59+00,31255.0,Belred,Belred,Nonresidential,[BR-OR-1] Bel-Red-Office/Residential Node 1,
-122.141562222,47.610237137000105,14812 Main St,Bellevue,98007,Closed,2021,Server Room AC,"Remove and Replace Mitsubishi Split System HVAC unit, None",2021/05/07 06:59:59+00,864.0,Crossroads,Lake Hills,Nonresidential,[O] Office,54347.0
-122.17861715299999,47.6225647790001,1525 121st Ave NE,Bellevue,980052101,Issued,2021,Facebook Block 7 - Workplace,Mechanical tenant Improvement,2021/06/25 06:59:59+00,17394.0,Belred,Belred,Nonresidential,[BR-OR-2] Bel-Red-Office/Residential Node 2,
-122.17873104700001,47.622413136000006,1550 121st Ave NE,Bellevue,980052101,Issued,2021,Facebook Block 20 - Workplace,HVAC TI,2021/07/12 06:59:59+00,136281.0,Belred,Belred,Nonresidential,[BR-OR-1] Bel-Red-Office/Residential Node 1,
-122.17861715299999,47.6225647790001,1525 121st Ave NE,Bellevue,980052101,Issued,2021,FB B7 Structural,"Limited structural improvements Overall project area: Level 01: 14,826sf.  Level 02, 14,687sf.  Structural scope is limited to roughly 2,000sf of overall.",2021/04/02 06:59:59+00,10766.0,Belred,Belred,Nonresidential,[BR-OR-2] Bel-Red-Office/Residential Node 2,
-122.185621565,47.6229473230001,1220 116th Ave NE,Bellevue,980043826,Ready to Issue,2021,New Staff Door,We want to add an interior door that goes out of our suite #102 into the common area. This will be a staff entrance and exit only. It will not affect the current ingress or egress of patrons. We just want the staff to have another door they can go out to use the restroom or leave work without having to walk through the patient waiting area.,,305.0,Belred,Belred,Nonresidential,[BR-MO-1] Bel-Red-Medical Office Node,25064.0
-122.185621565,47.6229473230001,1220 116th Ave NE,Bellevue,980043826,Closed,2021,Seattle Sperm Bank,"Construct office & lab area in existing vacant suite.  No change to Use, suite boundary, occupant load, exiting or building insulation envelope.  New non-structural partitions & floor finish.",2021/02/25 08:00:00+00,2619.0,Belred,Belred,Nonresidential,[BR-MO-1] Bel-Red-Medical Office Node,25064.0
-122.15317041700001,47.6187198040001,914 140th Ave NE,Bellevue,980073482,Pending,2021,#5650 Wallace Wong,Remove existing asphalt shingles down to sheathing and replace with metal roof,,840.0,Wilburton/ne 8th St,Crossroads,Nonresidential,[O] Office,27808.0
-122.18018874399999,47.612277933,220 120th Ave NE,Bellevue,98005,Issued,2021,BardyDx,"Non structural interior Tenant Improvement. New partitions, doors and finishes.",2021/02/19 08:00:00+00,23674.0,Wilburton/ne 8th St,Wilburton,Nonresidential,[O] Office,
-122.13529760799999,47.582761725000104,15395 SE 30th Pl  - Bldg 4,Bellevue,98007653,Issued,2021,Wizards of the Coast,"Select demolition of non-structural partition walls and finishes, as well as select new construction of partition walls and finishes for new private offices and multipurpose room.",2021/02/09 08:00:00+00,7581.0,Eastgate,Eastgate,Nonresidential,[O] Office,
-122.202009526,47.60886628,127 Bellevue Way SE,Bellevue,980046229,Issued,2021,127 Bellevue Way | 20-0506,"Non-structural tenant improvement consisting of new lighting, finishes & casework.",2021/02/17 08:00:00+00,1442.0,Southwest Bellevue,West Bellevue,Nonresidential,[O] Office,28001.0
-122.202009526,47.60886628,127 Bellevue Way SE,Bellevue,980046229,Issued,2021,127 Bellevue Way - Common Areas,"Non-structural common area improvements to consist of new LED lighting, finishes & restroom finish upgrades., 21 101367 BZ",2021/02/17 08:00:00+00,2664.0,Southwest Bellevue,West Bellevue,Nonresidential,[O] Office,28001.0
-122.191682055,47.627950854000105,1975 112th Ave NE,Bellevue,980042942,Closed,2021,Peak Sports & Spine,"TENANT IMPROVEMENT TO AN EXISTING OFFICE BUILDING WITH THE SCOPE OF WORK TO INCLUDE DEMOLITION OF WALLS, DOORS, GRID AND TILE, AND LIGHTING AS REQUIRED. CONSTRUCTION TO INCLUDE WALLS, DOORS, GRID AND TILE, LIGHTING AND CASEWORK. NO STRUCTURAL WORK IS REQUIRED. NO CHANGES TO CORE, SHELL, STRUCTURE, USE, OCCUPANCY, AND /OR EXITING.",2021/02/08 08:00:00+00,4229.0,North Bellevue,Northwest Bellevue,Nonresidential,[O] Office,51632.0
-122.182177959,47.61151985,11900 NE 1st St,Bellevue,98005303,Closed,2021,Chicago Title - Ridgewood G110 (#20-0535),"*20-114167 EA  Demolition of non-structural walls, existing finishes to remain, patch and repairing at demolished locations, new casework, new construction of interior non-structural walls. Relocation of existing light fixtures.",2021/03/15 06:59:59+00,4249.0,Wilburton/ne 8th St,Wilburton,Nonresidential,[O] Office,161252.0
-122.18728235299999,47.6050372220001,11400 SE 6th St,Bellevue,980046423,Issued,2021,SAVERS suite 125 / 130,"Non-structural Interior Tenant Improvement to combine Suite 125 and Suite 130. Select demolition, minimal new construction: partitions, doors, relites and finishes.",2021/07/16 06:59:59+00,9118.0,Southwest Bellevue,West Bellevue,Nonresidential,[OLB] Office and Limited Business,119921.0
-122.18989652,47.596642236,1715 114th Ave SE,Bellevue,980046904,Closed,2021,BOP Woodridge - CT Replacement,Installation of 3 ft x 3 ft stand for cooling tower (record # 21 108897 BL),2021/06/09 06:59:59+00,279.0,Southwest Bellevue,West Bellevue,Nonresidential,[O] Office,
-122.18557085,47.619560083000096,1038 116th Ave NE  - Bldg C,Bellevue,98004461,Closed,2021,Design Market Demo  Suite 310,"Demolition of interior non-structural walls and suspended ceiling, construction of one accessible restroom to prepare building shell for future tenant not yet identified",2021/06/22 06:59:59+00,3094.0,Belred,Belred,Nonresidential,[BR-MO-1] Bel-Red-Medical Office Node,
-122.14884349100001,47.631448004,14335 NE 24th St  - Bldg B,Bellevue,980073739,Issued,2021,Overlake 520 W - Market Ready,Non structural construction of interior and lighting upgrades.,2021/07/30 06:59:59+00,4325.0,Belred,Belred,Nonresidential,[BR-OR] Bel-Red Office/Residential,
-122.186390556,47.607609804,301 116th Ave SE,Bellevue,980046401,Issued,2021,Ameriprise Financial,"Non-structural interior tenant improvement: work includes non-structural demolition, new partitions, doors, sidelight, casework and finishes.",2021/08/04 06:59:59+00,6109.0,Wilburton/ne 8th St,Wilburton,Nonresidential,[OLB] Office and Limited Business,157375.0
-122.186945344,47.626958079000104,1853 115th Ave NE,Bellevue,980043002,Issued,2021,AVOCADO MONTESSORI ACADEMY,"REPLACE CABIETS AND COUNTERTOP, REPAINT, REPLACE FLOORING MATERIAL.",2021/07/09 06:59:59+00,1275.0,Belred,Belred,Nonresidential,[BR-MO] Bel-Red-Medical Office,10051.0
-122.18734983,47.626984969,11409 NE 19th St,Bellevue,980043033,Issued,2021,AVOCADO MONTESSORI ACADEMY,Replace cabinets and flooring material and painting,2021/07/08 06:59:59+00,797.0,Belred,Belred,Nonresidential,[BR-MO] Bel-Red-Medical Office,9524.0
-122.189373164,47.605530721,11200 SE 6th St,Bellevue,980046403,Pending,2021,QR Main Lobby TI,"demolition of existing ceiling element and installation of new ceiling element; rework of associated electrical, mechanical, and fire sprinkler work",,763.0,Southwest Bellevue,West Bellevue,Nonresidential,[OLB] Office and Limited Business,394671.0
-122.181710514,47.6332846700001,11820 Northup Way,Bellevue,980051926,Ready to Issue,2021,BEL-SPRING - MARKET READY SUITE W130,"NON-STRUCTURAL INTERIOR TENANT IMPROVEMENT: WORK INCLUDES NON-STRUCTURAL DEMOLITION, NEW PARTITIONS, DOORS, SIDELIGHTS, CASEWORK AND FINISHES",,4764.0,Bridle Trails,Bridle Trails,Nonresidential,[OLB] Office and Limited Business,97728.0
-122.18019314,47.6117649110001,150 120th Ave NE,Bellevue,98005,Issued,2021,Windermere,"Tenant Improvement scope of work includes new non structural interior walls, finishes and lighting.",2021/08/19 06:59:59+00,3099.0,Wilburton/ne 8th St,Wilburton,Nonresidential,[O] Office,143349.0
-122.154088911,47.581822605000106,3180 139th Ave SE,Bellevue,98005,Closed,2021,ArenaNet Remodel 4th & 5th,"4336 SF Tenant Improvement to include demolition of non-structural interior partitions, doors, glazing, and lighting.  Construction of new non-structural interior partitions, doors, lighting and modification of door hardware.",2021/04/09 06:59:59+00,13011.0,Eastgate,Eastgate,Nonresidential,[OLB] Office and Limited Business,48168.0
-122.18981549899999,47.596510691999995,1756 114th Ave SE,Bellevue,980046931,Issued,2021,Edifecs,"Interior tenant improvement of new walls, doors, and finishes, 066287-0070",2021/07/07 06:59:59+00,6109.0,Southwest Bellevue,West Bellevue,Nonresidential,[O] Office,302067.0
-122.20687615700001,47.6102456090001,1 100th Ave NE,Bellevue,98004,Issued,2021,Coldstream Tantallon TI Suite 102,"4,030 square foot tenant improvement including the following scope of work:  demolition of existing doors, interior partitions, ceiling and finishes.  Addition of new doors, interior partitions, ceilings and finishes.",2021/07/30 06:59:59+00,11611.0,North Bellevue,Northwest Bellevue,Nonresidential,[O] Office,43646.0
-122.190085798,47.6045000660001,11245 SE 6th St,Bellevue,98004,Issued,2021,Simply Fun Ste 110,"Interior non-structural alterations to 3725 (Floor 1); demolition and construction of partitions, doors, lighting and finishes.",2021/04/21 06:59:59+00,4698.0,Southwest Bellevue,West Bellevue,Nonresidential,[OLB] Office and Limited Business,
-122.152882634,47.632211452,14030 NE 24th St,Bellevue,980073729,Issued,2021,PHYNET DERMATOLOGY,"INTERIOR REMODEL (NON-STRUCTURAL) TO MODIFY THE EXISTING SPACE FOR A 4,492 SQ FT DERMATOLOGY OFFICE WITH INTERIOR PARTITIONS, EQUIPMENT, FINISHES AND LIGHTING.",2021/06/28 06:59:59+00,7567.0,Bridle Trails,Bridle Trails,Nonresidential,[PO] Professional Office,39588.0
-122.13529760799999,47.582761725000104,15395 SE 30th Pl  - Bldg 4,Bellevue,98007653,Ready to Issue,2021,T-Mobile Lab Decomissioning,"Existing technical computer lab (7,991 SF) is being decommissioned and all associated, non base building, equipment is being removed.  Any openings left in fire rated walls due to removal of conduits, etc. Will be patched to maintain integrity of fire separation.  Any modifications to the space will be permitted under separate package when the landlord re-leases the space.  Note that this is an equipment demolition project only other than patching of the walls.",,2446.0,Eastgate,Eastgate,Nonresidential,[O] Office,
-122.17873104700001,47.622413136000006,1550 121st Ave NE,Bellevue,980052101,Issued,2021,FB MB Cafe,"Renovation of existing Cafe, addition of a new Cafe.  Project area: 47,205sf",2021/07/14 06:59:59+00,56115.0,Belred,Belred,Nonresidential,[BR-OR-1] Bel-Red-Office/Residential Node 1,
