X,Y,SITEADDRESS,CITY,ZIPCODE,PERMITSTATUS,PERMITYEAR,PROJECTNAME,PROJECTDESCRIPTION,ISSUEDDATE,TOTALPAID,SUBAREA,NEIGHBORHOODAREA,SUBTYPE,ZONING,LOTSIZE
-122.14417181799999,47.577973038,14710 SE 36th St,Bellevue,98006,Issued,2021,Eastview Corporate Plaza,"Construction of a new parking lot to provide additional parking for the adjacent building, 20 120471 DB",2021/08/10 06:59:59+00,2121.5,Eastgate,Eastgate,Nonresidential,[O] Office,14998.0
-122.19204146,47.594709403000095,1745 114th Ave SE,Bellevue,98004693,Pending,2021,Mercer Pointe Parking Lot Repair,"The project proposes routine maintenance of the a parking lot at the Bellefield Office Park. Given the continuous settlement of the parking lot (1/2 to 1 inch per year), the pavement must be raised to its original condition. The parking lot area spans approximately 1.27 acres and will only consist of in-kind restoration. Construction will include removal of the existing asphalt pavement layer, the addition of lightweight fill to restore the grades, followed by typical pavement sections. The property is located in the Mercer Slough drainage basin and is surrounded by Type II wetlands. Construction activity will be limited to the parking lot area and there will be no encroachment into the wetlands. Existing stormwater drains into the wetlands and the Mercer Slough which is conveyed into Lake Washington. This path will be maintained., N/A",,1119.0,Southwest Bellevue,West Bellevue,Nonresidential,[O] Office,259625.0
-122.178239983,47.627521339000104,1975 124th Ave NE,Bellevue,980052113,Pending,2021,East Base Yard Lighting - Phase 2,"Replace/upgrade yard lighting: replace some poles, some lighting fixtures, add new poles w/fixtures, associated trenching and electrical work. Critical Area land use permit in process, building permit coming next. This is Phase 2 - all the work that could not be done before because it was in critical area/critical area buffer., 21 107830 LO",,1119.0,Belred,Belred,Nonresidential,[BR-OR-2] Bel-Red-Office/Residential Node 2,716631.0
-122.176470444,47.61975133600001,1121 124th Ave NE  - Lot 5,Bellevue,980052101,Pending,2021,COBT 124th Ave NE - Ichigo Way to Northup Way,"he City of Bellevue is developing plans and specifications for the widening of 124th Avenue NE between NE Ichigo Way to Northup Way to include a 5-lane roadway, illumination, traffic signals, curb/gutter, drainage infrastructure, landscaping, and sidewalks. The project also includes roadway pavement restoration and a multi-use pedestrian path between NE 16th Street and NE Ichigo Way to tie in with the recently constructed 124th Avenue NE corridor to the south. Other elements of design include improved commercial entrances, a fish passable culvert at the 124th Avenue NE/NE Ichigo Way intersection, and pedestrian access improvements along the corridor.",,1221.75,Belred,Belred,Nonresidential,[BR-OR-2] Bel-Red-Office/Residential Node 2,47178.0
-122.12845026299999,47.630392935,15805 NE 24th St,Bellevue,980082409,Pending,2021,COBU Commercial Water Meter Replacement 2022,"Project replaces four commercial water meters, including meter vaults, at three separate commercial properties.  Work includes excavation and backfill for installation of vaults and associated water piping, and restoration of disturbed surfaces (pavement, lawn, and landscaping) to match existing conditions.",,41.0,Crossroads,Northeast Bellevue,Nonresidential,[O] Office,538696.0
-122.142299761,47.599189970000104,14810 Lake Hills Blvd,Bellevue,98007,Pending,2021,COBT - Lake Hills Blvd & 148th Ave SE Improvements,"This project will construct an additional westbound to southbound turn-lane along Lake Hills Blvd at 148th Ave SE. The work includes but is not limited to: removing and replacing cement concrete curb, gutter, sidewalk, curb ramps, traffic island, and landscaping. The project also includes grind and overlay asphalt pavement, storm drainage improvements along Lake Hills Blvd, traffic signal system improvements at the intersection of Lake Hills Blvd & 148th Ave SE, and new street light poles along Lake Hills Blvd.",,41.0,Southeast Bellevue,Lake Hills,Nonresidential,[PO] Professional Office,12538.0
-122.17606798899999,47.618097978,12320 NE 8th St,Bellevue,980053186,Closed,2021,Affinity Group Sign,Installing a permanent exterior sign to identify the business,2021/05/18 06:59:59+00,566.0,Wilburton/ne 8th St,Wilburton,Nonresidential,[O] Office,24794.0
-122.135142082,47.582592973000004,15375 SE 30th Pl  - Bldg 3,Bellevue,98007653,Closed,2021,Hidden Path Entertainment,Installation of (1) internally illuminated wall-mounted channel cloud sign,2021/03/05 08:00:00+00,525.0,Eastgate,Eastgate,Nonresidential,[O] Office,
-122.17956343700001,47.615911829,626 120th Ave NE,Bellevue,980053039,Closed,2021,Next Home Profilic,Replacing existing channel letter sign with Non-electric dimensional sign on the face of the unit and refacing the existing post sign.,2021/03/23 06:59:59+00,462.0,Wilburton/ne 8th St,Wilburton,Nonresidential,[O] Office,55348.0
-122.19435475,47.637575629,3009 112th Ave NE,Bellevue,980042066,Issued,2021,AXIA Home Loans,Installing (1) wall sign on north storefront.,2021/07/21 06:59:59+00,566.0,North Bellevue,Northwest Bellevue,Nonresidential,[OLB] Office and Limited Business,
-122.186857068,47.610843431000006,11400 Main St,Bellevue,98004,Issued,2021,Extended Stay Bellevue,Reface existing signs,2021/07/20 06:59:59+00,566.0,Wilburton/ne 8th St,Wilburton,Nonresidential,[OLB] Office and Limited Business,291357.0
-122.185031072,47.6271955710001,1900 116th Ave NE  - Unit 100,Bellevue,980043013,Issued,2021,NORTHWEST MEDICAL,REPLACED EXISTING MONUMENT SIGN WITH NEW D/F ILLUMINATED MONUMENT SIGN W/ FCO NON ILLUMINATED ADDRESS NUMBERS,2021/07/15 06:59:59+00,566.0,Belred,Belred,Nonresidential,[BR-MO] Bel-Red-Medical Office,
-122.18557123299999,47.6194913960001,1028 116th Ave NE  - Bldg B,Bellevue,98004461,Issued,2021,Lazzoni,Electronic Sign board on two sides of the building,2021/08/05 06:59:59+00,525.0,Belred,Belred,Nonresidential,[BR-MO-1] Bel-Red-Medical Office Node,
-122.17367309,47.6272433830001,1800 124th Ave NE,Bellevue,980052112,Issued,2021,Public Storage reimage,"Replace (1) existing non-illuminated ""Public Storage"" MID cabinet, install (1) non-illuminated ""Rental Office"" directional wall sign and reface and retro to LED (1) existing double sided pylon sign.",2021/07/22 06:59:59+00,462.0,Belred,Belred,Nonresidential,[BR-OR] Bel-Red Office/Residential,229383.0
-122.128351723,47.634562185,2701 NE Bellevue-Redmond Rd,Bellevue,980082253,Closed,2021,Eton School,New Sign at entry to school.  Sign is carved on a boulder that will be placed in an existing landscaped area.,2021/08/24 06:59:59+00,462.0,Crossroads,Northeast Bellevue,Nonresidential,[PO] Professional Office,61142.0
-122.185268425,47.629533688,2168 116th Ave NE  - Lot B,Bellevue,980043048,Pending,2021,Bellevue Senior Housing,"Installation of 6 signs including building mounted signs and monument signs., 18-108458 BB",,1299.0,Belred,Belred,Nonresidential,[BR-MO] Bel-Red-Medical Office,125492.0
-122.19435475,47.637575629,3009 112th Ave NE,Bellevue,980042066,Pending,2021,MN Custom Homes,Installing (1) tenant wall sign.,,503.0,North Bellevue,Northwest Bellevue,Nonresidential,[OLB] Office and Limited Business,
-122.18557085,47.619560083000096,1038 116th Ave NE  - Bldg C,Bellevue,98004461,Issued,2021,BG HOME,"INSTALL(1) WALL MOUNTED SINGLE-FACED SIGN WITH HALO ILLUMINATED CHANNEL LETTERS READING ""BG HOME FURNITURE & ACCESSORIES""",2021/08/26 06:59:59+00,566.0,Belred,Belred,Nonresidential,[BR-MO-1] Bel-Red-Medical Office Node,
-122.185675283,47.6153778770001,625 116th Ave NE,Bellevue,980045207,Open,2021,DWN UNDER,INSTALL SINGLE FACE ILLUMINATED WALL SIGN,,462.0,Wilburton/ne 8th St,Wilburton,Nonresidential,[OLB] Office and Limited Business,158406.0
-122.12259426600001,47.556033365000104,5130 164th Ave SE,Bellevue,980061954,Issued,2021,Summit Classical Christian School,"Change of occupancy from A-3 (Religious Institution, Church) to E (K-12 School) during weekdays only.  Church will remain in operation on evenings and weekends.  No change to existing building proposed except for furniture layout.",2021/08/12 06:59:59+00,7279.25,Newcastle,Cougar Mountain / Lakemont,Nonresidential,[O] Office,196563.0
-122.172740837,47.6198802970001,12501 NE Bellevue-Redmond Rd,Bellevue,980052508,Pending,2021,Iskcon Temple 2021 LA Permit,"New Conditional Use LA permit required due to change of use from previously approved permit submitted in 2014, 20-122691 BY",,5835.7,Belred,Belred,Nonresidential,[BR-ORT] Bel-Red-Office/Residential Transition,50003.0
-122.17505454100001,47.6201213860001,1209 124th Ave NE,Bellevue,980052101,Closed,2021,Spring District - Binding Site Plan Amendment 7,Seventh Amendment to The Spring District Binding Site Plan.,2021/05/06 06:59:59+00,1147.25,Belred,Belred,Nonresidential,[BR-OR-2] Bel-Red-Office/Residential Node 2,829376.0
-122.191682055,47.627950854000105,1975 112th Ave NE,Bellevue,980042942,Pending,2021,Bellewood One,Removal of Cottonwood trees - no removal of stumps.,,555.25,North Bellevue,Northwest Bellevue,Nonresidential,[O] Office,51632.0
-122.128840315,47.616479012000106,15831 NE 8th St,Bellevue,98008-3916,Issued,2021,Crossroads Tree Removal,Removal of 6 trees,2021/09/17 06:59:59+00,531.0,Crossroads,Lake Hills,Nonresidential,[O] Office,35148.0
-122.165852985,47.6213115360001,13037 NE Bellevue-Redmond Rd,Bellevue,980052622,Ready to Issue,2021,13037 Bel-Red Tree Removal,Remove 10 trees and overgrown arborvitae,,415.0,Belred,Belred,Nonresidential,[BR-ORT] Bel-Red-Office/Residential Transition,55755.0
-122.202009526,47.60886628,127 Bellevue Way SE,Bellevue,980046229,Issued,2021,Rgm Tree Removal,Removal of 2 cottonwood trees,2021/07/07 06:59:59+00,531.0,Southwest Bellevue,West Bellevue,Nonresidential,[O] Office,28001.0
-122.129432546,47.633884108000096,2663 NE Bellevue-Redmond Rd,Bellevue,980052142,Issued,2021,"Tree Removal, Sherwood Forest Office Park","Removal of 1 Flowering Cherry (Prunus sp.), 20.9"" DBH, 40' H",2021/09/02 06:59:59+00,531.0,Crossroads,Northeast Bellevue,Nonresidential,[PO] Professional Office,40212.0
-122.189187766,47.6360778660001,2800 Northup Way,Bellevue,98004144,Issued,2021,Northup West Tree Care 2021,"Removal of 2 dead/dying significant trees (15"" and 12.5"" DBH Western Hemlocks) - see arborist report for assessments, 1 non-significant tree (<6"" DBH Japanese Maple - large woody debris to be retained in greenbelt), 4 replants (Cascara, Rhamnus purshiana), and clearance pruning/risk mitigation pruning on 6 other trees (see site plan for specifics).",2021/09/01 06:59:59+00,531.0,North Bellevue,Northwest Bellevue,Nonresidential,[OLB] Office and Limited Business,219442.0
-122.18173977100001,47.6111496440001,11911 NE 1st St,Bellevue,980053032,Pending,2021,Removal of Dying trees,This permit request is for the removal of 6 dying trees that are becoming hazards on two adjacent parcels that currently have 3 story commercial buildings located on them.,,415.0,Wilburton/ne 8th St,Wilburton,Nonresidential,[O] Office,114170.0
-122.18652520399999,47.6291305030001,11504 NE 21st St,Bellevue,980043025,Pending,2021,Life Zone Senior Medical,"The proposed 4 story mixed use senior living building with a basement of senior living units of total 14 units senior living units, medical building and pharmacy and two story senior living and roof garden and a club house., 19-125693-DB",,14939.0,Belred,Belred,Nonresidential,[BR-MO] Bel-Red-Medical Office,9603.0
-122.17632385299999,47.6218996040001,1325 123rd Ave NE,Bellevue,98005,Pending,2021,Block 13 - Design Review,"Block 13 in The Spring District is a new, nine-story office building with four floors of below-grade structured parking centrally located in the District and bounded by the MDP-approved private 122nd Ave. N.E. to the west, N.E. 14th Terrace to the north, 123rd Ave. N.E. to the east, and an existing plaza to the south.",,14243.0,Belred,Belred,Nonresidential,[BR-OR-1] Bel-Red-Office/Residential Node 1,829376.0
-122.13114584899999,47.631935565,15650 NE 24th St,Bellevue,980072406,Pending,2021,Bel-Red Medical Building,Demolition of 2 existing single story office buildings and construction of a single 3 story office building with 1 level below grade parking,,22053.0,Crossroads,Northeast Bellevue,Nonresidential,[O] Office,27203.0
-122.17632385299999,47.6218996040001,1325 123rd Ave NE,Bellevue,98005,Pending,2021,Block 13 - Variance Request,"Block 13 in The Spring District is a new, nine-story office building with four floors of below-grade, structured parking centrally located in the District and bounded by the MDP-approved, private 122nd Avenue NE to the west, NE 14th Terrace to the north, 123rd Avenue NE to the east, and an existing plaza to the south.",,1615.0,Belred,Belred,Nonresidential,[BR-OR-1] Bel-Red-Office/Residential Node 1,829376.0
-122.18717820100001,47.6304225100001,2275 116th Ave NE,Bellevue,980043032,Closed,2021,SD30 5G/NR 2021,Relocate existing sector 2 antennas and equipment to the southwest parapet of the existing building rooftop and conceal behind (and anchored to) new FRP screen wall assembly. Replace existing FRP screening with new FRP screen wall assembly for Sector 1 and Sector 3 antennas and equipment. Temp COW required during site upgrade.,2021/07/15 06:59:59+00,355.0,Belred,Belred,Nonresidential,[BR-MO] Bel-Red-Medical Office,45635.0
-122.17840607,47.622380299999996,1444 121st Ave NE,Bellevue,980052101,Issued,2021,Bellevue Spring District Farmers Market,"Wednesday Farmers Markets from 11am-2pm on 7/14, 8/4, 8/18, and 9/1, 2021. Featuring local farmers and food producers for the residence and visitors of the Bellevue Spring District.",2021/07/10 06:59:59+00,535.0,Belred,Belred,Nonresidential,[BR-OR-1] Bel-Red-Office/Residential Node 1,15704.0
-122.12677983299999,47.6205598060001,16000 NE 10th St,Bellevue,98008391,Issued,2021,COBP-Crossroads Community Center Vaccination Site,Seattle/King County Public Health exercising existing MOU with City of Bellevue to activate a community point of distribution in Community Center.,2021/07/12 06:59:59+00,535.0,Crossroads,Crossroads,Nonresidential,[O] Office,1164222.0
-122.18934732,47.607244888000004,300 112th Ave SE,Bellevue,980046412,Pending,2021,Zumiez Vendor Village,Parking lot event for Zumiez Managers Meetings,,355.0,Southwest Bellevue,West Bellevue,Nonresidential,[OLB] Office and Limited Business,414376.0
-122.17505454100001,47.6201213860001,1209 124th Ave NE,Bellevue,980052101,Closed,2021,Block 15 - Preapplication Conference,"Block 15 is an 11-story office building with retail at ground level and six levels of below-grade structured parking at The Spring District in Bellevue, Washington.",2021/08/04 06:59:59+00,,Belred,Belred,Nonresidential,[BR-OR-2] Bel-Red-Office/Residential Node 2,829376.0
-122.176148612,47.62380683600001,1646 123rd Ave NE  - Lot 6,Bellevue,980052101,Closed,2021,Block 6,"Set up a mobile crane on Sunday 5/16/21 in our laydown yard next to our jobsite to erect our tower crane on Monday 5/17/21., 20 109080 BB",2021/05/10 06:59:59+00,187.0,Belred,Belred,Nonresidential,[BR-OR-1] Bel-Red-Office/Residential Node 1,
-122.176148612,47.62380683600001,1646 123rd Ave NE  - Lot 6,Bellevue,980052101,Closed,2021,Block 6,"Pouring concrete elevator shaft., 20 109080 BB",2021/05/27 06:59:59+00,187.0,Belred,Belred,Nonresidential,[BR-OR-1] Bel-Red-Office/Residential Node 1,
-122.176148612,47.62380683600001,1646 123rd Ave NE  - Lot 6,Bellevue,980052101,Issued,2021,Block 6,"Erect Tower Crane and pour elevator concrete shaft., 20 109080 BB",2021/05/21 06:59:59+00,187.0,Belred,Belred,Nonresidential,[BR-OR-1] Bel-Red-Office/Residential Node 1,
-122.176148612,47.62380683600001,1646 123rd Ave NE  - Lot 6,Bellevue,980052101,Issued,2021,Block 6,"Road Closure on Spring Blvd from 124th Ave NE to 121st  Ave NE  to stage a 550 mobile crane in the roadway to remove the conveyor.  Detour will be in place., 20 109080 BB",2021/06/17 06:59:59+00,187.0,Belred,Belred,Nonresidential,[BR-OR-1] Bel-Red-Office/Residential Node 1,
-122.176148612,47.62380683600001,1646 123rd Ave NE  - Lot 6,Bellevue,980052101,Issued,2021,Block 6,Early start hours for concrete pour on June 28th and 29th due to high heat forecast.  High Heat poses a risk to quality of the pour.  Applicant proposes to begin work at 5:00 a.m.  20 109080 BB,2021/06/25 06:59:59+00,187.0,Belred,Belred,Nonresidential,[BR-OR-1] Bel-Red-Office/Residential Node 1,
-122.176148612,47.62380683600001,1646 123rd Ave NE  - Lot 6,Bellevue,980052101,Issued,2021,Block 6,"Pouring LV B concrete deck. Can only get concrete early in the morning., 20 111133 BB",2021/08/11 06:59:59+00,187.0,Belred,Belred,Nonresidential,[BR-OR-1] Bel-Red-Office/Residential Node 1,
-122.176148612,47.62380683600001,1646 123rd Ave NE  - Lot 6,Bellevue,980052101,Issued,2021,Block 6,"Due to high temperatures we need to start the concrete pour at 7 AM., Work is allowed Sat Aug 14, 2021 from 7am to 3pm",2021/08/12 06:59:59+00,187.0,Belred,Belred,Nonresidential,[BR-OR-1] Bel-Red-Office/Residential Node 1,
-122.20134775700001,47.6067540020001,410 Bellevue Way SE,Bellevue,980045015,Closed,2021,SE02407A Kilmarnock Building - T-Mobile  L600 Mods,"Replace (2) panel antennas, add (2) RRUS, modify existing FRP for new antennas, add (1) junction box with (2) jumper cables at equipment area.",2021/09/30 06:59:59+00,1263.0,Southwest Bellevue,West Bellevue,Nonresidential,[O] Office,47816.0
-122.17367309,47.6272433830001,1800 124th Ave NE,Bellevue,980052112,Issued,2021,Verizon Wireless - SEA Safeway,"The applicant, Verizon, proposes to modify an existing telecommunication facility at 1800 124th Avenue NE, Bellevue, WA (Parcel Number 282505-9262). The proposed modification will consist of: adding three (3) new antennas and modify auxiliary equipment., LAND USE ID# 942938",2021/06/23 06:59:59+00,1109.0,Belred,Belred,Nonresidential,[BR-OR] Bel-Red Office/Residential,229383.0
-122.157124965,47.616852509000104,13635 NE 8th St,Bellevue,98005,Issued,2021,Verizon Wireless - SEA Glendale,Modification to an existing wireless facility.  Associated land-use permit #21 106972 DC.,2021/05/13 06:59:59+00,1109.0,Wilburton/ne 8th St,Crossroads,Nonresidential,[O] Office,21637.0
-122.20134775700001,47.6067540020001,410 Bellevue Way SE,Bellevue,980045015,Issued,2021,SE02407A Kilmarnock Building - T-Mobile Anchor Mod,"T-Mobile is proposing the following modifications to the existing rooftop wireless facility: Remove and replace (4) existing antennas with (3) new antennas, Modify existing FRP panel on antenna screen to accommodate the new antennas, Install (2) new RRUs near the antennas, Remove (8) existing TMAs, Remove and replace (3) cabinets with (2) new cabinets, Install (3) new Rooftop junction boxes with jumpers to the new RRUs, Install (1) new fiber cube cabinet, Remove and replace (1) existing AC panel for (1) new 200A AC panel and upgrade power, Remove and replace (1) step-down transformer, and (1) technician light, and Remove (8) coax cables and (8) diplexers.",2021/05/20 06:59:59+00,1109.0,Southwest Bellevue,West Bellevue,Nonresidential,[O] Office,47816.0
-122.189327125,47.5959349460001,1800 114th Ave SE,Bellevue,98004,Ready to Issue,2021,SE02614A Spieker Bellefield (L600; Anchor) - T-Mob,"Eligible Facilities Request for an existing rooftop mounted WCF. On the rooftop of the existing office building, replace (2) of the existing (4) panel antennas and add (2) new panel antennas for a new total of (6), replace all (4) remote radio units, remove (4) over-voltage protector units, add (2) hybrid cable junction boxes, remove (8) diplexer units at the antennas, add (4) diplexer units at the radio cabinets, and replace (2) of the existing (3) radio equipment cabinets., N/A",,994.0,Southwest Bellevue,West Bellevue,Nonresidential,[O] Office,184965.0
-122.190039805,47.622049848000096,1200 112th Ave NE  - Bldg A,Bellevue,980043708,Ready to Issue,2021,Sea Horse,"Remove 12 antennas and equipment, replace with l2 antennas and equipment per plans.  6409 approval # 21-107344-DC",,1109.0,North Bellevue,Northwest Bellevue,Nonresidential,[OLB] Office and Limited Business,
-122.18717820100001,47.6304225100001,2275 116th Ave NE,Bellevue,980043032,Issued,2021,SD30 5G/NR 2021,Relocate existing sector 2 antennas and equipment to the southwest parapet of the existing building rooftop and conceal behind (and anchored to) new FRP screen wall assembly. Replace existing FRP screening with new FRP screen wall assembly for Sector 1 and Sector 3 antennas and equipment.,2021/08/05 06:59:59+00,1109.0,Belred,Belred,Nonresidential,[BR-MO] Bel-Red-Medical Office,45635.0
-122.18728235299999,47.6050372220001,11400 SE 6th St,Bellevue,980046423,Ready to Issue,2021,Verizon Wireless SEA Bellevue Hilton 5G,"AT an existing rooftop (unscreened) wireless facility; removed 9 panel antennas, 4 RRUs, 2 diplexer, 4 in cabinet radios, rmeove electrical and remove 4 cabinets.  ADD 2 LS6 antennas, add one 5G antenna, add 4 panel antennas, add one dual-mount bracket, add 2 RRUs, add 4 dummy block per plan, 21 111335 DC",,1109.0,Southwest Bellevue,West Bellevue,Nonresidential,[OLB] Office and Limited Business,119921.0
-122.185675283,47.6153778770001,625 116th Ave NE,Bellevue,980045207,Closed,2021,Sea Belleville,"Existing WCF concealed enclosure, exchanging 6 antenna and add 6 new antennas all within concealment.  No change to height or appearance of WCF.",2021/06/17 06:59:59+00,374.0,Wilburton/ne 8th St,Wilburton,Nonresidential,[OLB] Office and Limited Business,158406.0
-122.15612387,47.623483949,13831 NE Bellevue-Redmond Rd,Bellevue,980054519,Pending,2021,Early World Childrens School Bridge Replacement,"The existing lower wooden bridge on-site, which provides vehicular access from NE Bel-Red Road to the Early World Childrens School, has deteriorated to a point that it is no longer usable. The bridge spans Kelsey Creek, a Type F stream. The bridge is proposed for replacement in the same location. Of note, the bridge ties into the City of Bellevue sidewalk system, which in the subject location, includes a combination of asphalt, concrete, and wood decking that is cantilevered over the stream.",,3309.5,Belred,Belred,Nonresidential,[BR-ORT] Bel-Red-Office/Residential Transition,21590.0
-122.127868702,47.629201816000005,2125 158th Ct NE  - Bldg C,Bellevue,980082409,Pending,2021,Bellevue Tech Center,Installation of a 20'x60' retractable awning,,224.0,Crossroads,Northeast Bellevue,Nonresidential,[O] Office,
-122.18728235299999,47.6050372220001,11400 SE 6th St,Bellevue,980046423,Closed,2021,Verizon Wireless SEA Bellevue Hilton 5G,"At an existing approved rooftop WCF, remove 9 panel antennas, ancillary/electrical, remove two equipment cabinets.  Add two LSg antennas, add one 5G antenna, add 4 panel antennas, add one dual mount brackets, add 2 RRUs and 4 dummyblocks per plan, LJ 14 144014",2021/07/27 06:59:59+00,374.0,Southwest Bellevue,West Bellevue,Nonresidential,[OLB] Office and Limited Business,119921.0
-122.178239983,47.627521339000104,1975 124th Ave NE,Bellevue,980052113,Closed,2021,East Base UST Replacement,"West wall of the East Base Fuel & Wash Building. We want to place two (2) new, non-fuel, aboveground storage tanks (ASTs) in that location with spill bucket ports for delivery by vendors.  I have attached a sheet that shows an early 30pct Design level of what we might expect in that location.  We would like to get some clarity on whether or not this alcove is considered interior or exterior because we think an exterior designation may require that we seek a Critical Areas Land Use Permit from the City of Bellevue, whereas an interior designation may not.",2021/04/30 06:59:59+00,626.25,Belred,Belred,Nonresidential,[BR-OR-2] Bel-Red-Office/Residential Node 2,716631.0
-122.126540961,47.61772913,16000 NE 8th St,Bellevue,980083939,Closed,2021,SEA CROSSROADS MALL (LS6) - Verizon,"This project replaces 19-131614-DC and 20 101156 CD, which was never installed. On the rooftop of the existing three-story multi-tenant apartment building and inside the existing Verizon screened enclosure, remove all (12) antennas and replace with (10) antennas, remove (3) remote radio units, add (6) combiner units, replace (1) over-voltage protector (OVP), and replace (1) hybrid cable trunk line., N/A",2021/02/03 08:00:00+00,187.0,Crossroads,Crossroads,Nonresidential,[O] Office,62311.0
-122.17367309,47.6272433830001,1800 124th Ave NE,Bellevue,980052112,Closed,2021,Verizon Wireless - SEA Safeway DC,"Verizon Wireless proposes to modify an existing telecommunication facility at 1800 124th Avenue NE, Bellevue, WA (Parcel Number 282505-9262). The proposed modification will consist of: adding three (3) new antennas and modify auxiliary equipment.  Verizon Wireless is requesting the review and approval of an Eligible Facilities Request.",2021/05/27 06:59:59+00,935.0,Belred,Belred,Nonresidential,[BR-OR] Bel-Red Office/Residential,229383.0
-122.157124965,47.616852509000104,13635 NE 8th St,Bellevue,98005,Closed,2021,Verizon Wireless - SEA Glendale,"Verizon Wireless proposes to modify an existing telecommunication facility at 13635 NE 8th Street, Bellevue, WA (Parcel Number 3425059103). The proposed modification will consist of: removing six (6) antennas, adding six (6) new antennas, and modifying auxiliary equipment.",2021/04/13 06:59:59+00,149.6,Wilburton/ne 8th St,Crossroads,Nonresidential,[O] Office,21637.0
-122.190039805,47.622049848000096,1200 112th Ave NE  - Bldg A,Bellevue,980043708,Closed,2021,Sea Horse,"Remove and exchange antennas and equipment on existing WCF, all antennas and equipment withing existing concealment.",2021/05/03 06:59:59+00,140.25,North Bellevue,Northwest Bellevue,Nonresidential,[OLB] Office and Limited Business,
